{
  "schema_version": "2.0.0",
  "queue_version": "2.0.0",
  "updated_at": "2026-07-12",
  "generation_frozen": true,
  "items": [
    {
      "case_id": "CP-P001-C001",
      "pattern_id": "CP-P001",
      "phase_id": "PHASE-1",
      "evolution_slot": 1,
      "evolution_type": "classic_basic",
      "title": "Dangerous chest pain",
      "authorised": false,
      "status": "not_started",
      "canonical_path": null,
      "reasoning_path": null,
      "audit_path": null,
      "learner_path": null,
      "authorised_by": null,
      "authorised_at": null,
      "authorisation_command": null
    },
    {
      "case_id": "CP-P001-C002",
      "pattern_id": "CP-P001",
      "phase_id": "PHASE-1",
      "evolution_slot": 2,
      "evolution_type": "dangerous_trap",
      "title": "Dangerous chest pain",
      "authorised": false,
      "status": "not_started",
      "canonical_path": null,
      "reasoning_path": null,
      "audit_path": null,
      "learner_path": null,
      "authorised_by": null,
      "authorised_at": null,
      "authorisation_command": null
    },
    {
      "case_id": "CP-P001-C003",
      "pattern_id": "CP-P001",
      "phase_id": "PHASE-1",
      "evolution_slot": 3,
      "evolution_type": "benign_looking_mimic",
      "title": "Dangerous chest pain",
      "authorised": false,
      "status": "not_started",
      "canonical_path": null,
      "reasoning_path": null,
      "audit_path": null,
      "learner_path": null,
      "authorised_by": null,
      "authorised_at": null,
      "authorisation_command": null
    },
    {
      "case_id": "CP-P001-C004",
      "pattern_id": "CP-P001",
      "phase_id": "PHASE-1",
      "evolution_slot": 4,
      "evolution_type": "complex_high_pressure",
      "title": "Dangerous chest pain",
      "authorised": false,
      "status": "not_started",
      "canonical_path": null,
      "reasoning_path": null,
      "audit_path": null,
      "learner_path": null,
      "authorised_by": null,
      "authorised_at": null,
      "authorisation_command": null
    },
    {
      "case_id": "CP-P002-C005",
      "pattern_id": "CP-P002",
      "phase_id": "PHASE-1",
      "evolution_slot": 1,
      "evolution_type": "classic_basic",
      "title": "Acute breathlessness",
      "authorised": false,
      "status": "not_started",
      "canonical_path": null,
      "reasoning_path": null,
      "audit_path": null,
      "learner_path": null,
      "authorised_by": null,
      "authorised_at": null,
      "authorisation_command": null
    },
    {
      "case_id": "CP-P002-C006",
      "pattern_id": "CP-P002",
      "phase_id": "PHASE-1",
      "evolution_slot": 2,
      "evolution_type": "dangerous_trap",
      "title": "Acute breathlessness",
      "authorised": false,
      "status": "not_started",
      "canonical_path": null,
      "reasoning_path": null,
      "audit_path": null,
      "learner_path": null,
      "authorised_by": null,
      "authorised_at": null,
      "authorisation_command": null
    },
    {
      "case_id": "CP-P002-C007",
      "pattern_id": "CP-P002",
      "phase_id": "PHASE-1",
      "evolution_slot": 3,
      "evolution_type": "benign_looking_mimic",
      "title": "Acute breathlessness",
      "authorised": false,
      "status": "not_started",
      "canonical_path": null,
      "reasoning_path": null,
      "audit_path": null,
      "learner_path": null,
      "authorised_by": null,
      "authorised_at": null,
      "authorisation_command": null
    },
    {
      "case_id": "CP-P002-C008",
      "pattern_id": "CP-P002",
      "phase_id": "PHASE-1",
      "evolution_slot": 4,
      "evolution_type": "complex_high_pressure",
      "title": "Acute breathlessness",
      "authorised": false,
      "status": "not_started",
      "canonical_path": null,
      "reasoning_path": null,
      "audit_path": null,
      "learner_path": null,
      "authorised_by": null,
      "authorised_at": null,
      "authorisation_command": null
    },
    {
      "case_id": "CP-P003-C009",
      "pattern_id": "CP-P003",
      "phase_id": "PHASE-1",
      "evolution_slot": 1,
      "evolution_type": "classic_basic",
      "title": "Collapse syncope and shock",
      "authorised": false,
      "status": "not_started",
      "canonical_path": null,
      "reasoning_path": null,
      "audit_path": null,
      "learner_path": null,
      "authorised_by": null,
      "authorised_at": null,
      "authorisation_command": null
    },
    {
      "case_id": "CP-P003-C010",
      "pattern_id": "CP-P003",
      "phase_id": "PHASE-1",
      "evolution_slot": 2,
      "evolution_type": "dangerous_trap",
      "title": "Collapse syncope and shock",
      "authorised": false,
      "status": "not_started",
      "canonical_path": null,
      "reasoning_path": null,
      "audit_path": null,
      "learner_path": null,
      "authorised_by": null,
      "authorised_at": null,
      "authorisation_command": null
    },
    {
      "case_id": "CP-P003-C011",
      "pattern_id": "CP-P003",
      "phase_id": "PHASE-1",
      "evolution_slot": 3,
      "evolution_type": "benign_looking_mimic",
      "title": "Collapse syncope and shock",
      "authorised": false,
      "status": "not_started",
      "canonical_path": null,
      "reasoning_path": null,
      "audit_path": null,
      "learner_path": null,
      "authorised_by": null,
      "authorised_at": null,
      "authorisation_command": null
    },
    {
      "case_id": "CP-P003-C012",
      "pattern_id": "CP-P003",
      "phase_id": "PHASE-1",
      "evolution_slot": 4,
      "evolution_type": "complex_high_pressure",
      "title": "Collapse syncope and shock",
      "authorised": false,
      "status": "not_started",
      "canonical_path": null,
      "reasoning_path": null,
      "audit_path": null,
      "learner_path": null,
      "authorised_by": null,
      "authorised_at": null,
      "authorisation_command": null
    },
    {
      "case_id": "CP-P004-C013",
      "pattern_id": "CP-P004",
      "phase_id": "PHASE-1",
      "evolution_slot": 1,
      "evolution_type": "classic_basic",
      "title": "Severe abdominal pain",
      "authorised": false,
      "status": "not_started",
      "canonical_path": null,
      "reasoning_path": null,
      "audit_path": null,
      "learner_path": null,
      "authorised_by": null,
      "authorised_at": null,
      "authorisation_command": null
    },
    {
      "case_id": "CP-P004-C014",
      "pattern_id": "CP-P004",
      "phase_id": "PHASE-1",
      "evolution_slot": 2,
      "evolution_type": "dangerous_trap",
      "title": "Severe abdominal pain",
      "authorised": false,
      "status": "not_started",
      "canonical_path": null,
      "reasoning_path": null,
      "audit_path": null,
      "learner_path": null,
      "authorised_by": null,
      "authorised_at": null,
      "authorisation_command": null
    },
    {
      "case_id": "CP-P004-C015",
      "pattern_id": "CP-P004",
      "phase_id": "PHASE-1",
      "evolution_slot": 3,
      "evolution_type": "benign_looking_mimic",
      "title": "Severe abdominal pain",
      "authorised": false,
      "status": "not_started",
      "canonical_path": null,
      "reasoning_path": null,
      "audit_path": null,
      "learner_path": null,
      "authorised_by": null,
      "authorised_at": null,
      "authorisation_command": null
    },
    {
      "case_id": "CP-P004-C016",
      "pattern_id": "CP-P004",
      "phase_id": "PHASE-1",
      "evolution_slot": 4,
      "evolution_type": "complex_high_pressure",
      "title": "Severe abdominal pain",
      "authorised": false,
      "status": "not_started",
      "canonical_path": null,
      "reasoning_path": null,
      "audit_path": null,
      "learner_path": null,
      "authorised_by": null,
      "authorised_at": null,
      "authorisation_command": null
    },
    {
      "case_id": "CP-P005-C017",
      "pattern_id": "CP-P005",
      "phase_id": "PHASE-1",
      "evolution_slot": 1,
      "evolution_type": "classic_basic",
      "title": "Fever sepsis and meningitis",
      "authorised": false,
      "status": "not_started",
      "canonical_path": null,
      "reasoning_path": null,
      "audit_path": null,
      "learner_path": null,
      "authorised_by": null,
      "authorised_at": null,
      "authorisation_command": null
    },
    {
      "case_id": "CP-P005-C018",
      "pattern_id": "CP-P005",
      "phase_id": "PHASE-1",
      "evolution_slot": 2,
      "evolution_type": "dangerous_trap",
      "title": "Fever sepsis and meningitis",
      "authorised": false,
      "status": "not_started",
      "canonical_path": null,
      "reasoning_path": null,
      "audit_path": null,
      "learner_path": null,
      "authorised_by": null,
      "authorised_at": null,
      "authorisation_command": null
    },
    {
      "case_id": "CP-P005-C019",
      "pattern_id": "CP-P005",
      "phase_id": "PHASE-1",
      "evolution_slot": 3,
      "evolution_type": "benign_looking_mimic",
      "title": "Fever sepsis and meningitis",
      "authorised": false,
      "status": "not_started",
      "canonical_path": null,
      "reasoning_path": null,
      "audit_path": null,
      "learner_path": null,
      "authorised_by": null,
      "authorised_at": null,
      "authorisation_command": null
    },
    {
      "case_id": "CP-P005-C020",
      "pattern_id": "CP-P005",
      "phase_id": "PHASE-1",
      "evolution_slot": 4,
      "evolution_type": "complex_high_pressure",
      "title": "Fever sepsis and meningitis",
      "authorised": false,
      "status": "not_started",
      "canonical_path": null,
      "reasoning_path": null,
      "audit_path": null,
      "learner_path": null,
      "authorised_by": null,
      "authorised_at": null,
      "authorisation_command": null
    },
    {
      "case_id": "CP-P006-C021",
      "pattern_id": "CP-P006",
      "phase_id": "PHASE-1",
      "evolution_slot": 1,